{
  "schema_version": "1.0",
  "kind": "independent_visual_review",
  "status": "completed",
  "render_manifest_sha256": "7427db63eb65ab6f1f86de488642c2303a440528265605f02b56f63d98cc0dfe",
  "reviewer_context": "isolated_read_only",
  "reviewer_context_id": "/root/latest_pack_horizontal_reader",
  "pages": [
    {
      "page_id": "P00",
      "png_sha256": "99bdf2c43f73d6cb2529594dba66eb49de5406f248201a4a74a3e1e5eb8a692d",
      "review_packet_sha256": "08b53dd23bb642c045b7504a551ec449f493405421b795599fa114eef631f53c",
      "verdict": "TARGET",
      "findings": [
        "阅读：节目身份→原题→主动组合钩子→一杯失望/一托多选对照→类比边界→关键词与主讲时长。主区杯与托盘可识别，最强关系是相同单项失望在多选中保留其他选项；最弱是手机下主讲时长的品牌辅助行，核心与类比限定仍能辨。灰度保留叉号、托盘和文字层级。",
        "本次整包横审：已实际打开当前原图、390×520手机图与灰度图；未发现应重开本页完整审核的明确新内容关系、文字遮挡、手机关键内容不可读或系列归属阻断。",
        "完整等级来源沿用：[本地工作区]/outputs/EP59-交付待办逐项确认-2026-10-06/正式缺口修复-2026-10-06/current-review-inputs/P00/closeout-workspace/04-rendered/independent_visual_review.json；原报告文件SHA-256=664cd8dd27757d351ae31f725b2376a0cc647c4365aa145b952203c46a9dfad5；原审核上下文=/root/frozen_cover_overview_review。原报告PNG、原manifest canonical及当前scene/原图/390px/灰度四哈希一致，沿用原完整TARGET。本次横审不冒充新的单页完整审核。",
        "review_packet_sha256沿用原单页实际报告值08b53dd23bb642c045b7504a551ec449f493405421b795599fa114eef631f53c，该字段指向原单页包，不虚构本次新输入包。",
        "机械辅助：当前原生scene image=0/files=0；有效文字的typography_role与字号匹配共享当前tokens。参数与哈希核对不替代实图观察。"
      ]
    },
    {
      "page_id": "P01",
      "png_sha256": "53cd62848b1a2a42680958464868f4967631f66eb79cd2e8751a381a07086774",
      "review_packet_sha256": "cbf9f85eb4e519c143de6b22b638c53508805dc7eb1ed109d4e35c83eac2f424",
      "verdict": "TARGET",
      "findings": [
        "阅读：主标题→总判断→已有配置→四个并列方向逐列→现场回应→提纲地图页脚。四方向的同级标题和顶部连接明确并列、不定权重；AI理想/现实与注意力两种投入对照能定位。现场回应最密，390px需细读但具体结论和个人建议边界可辨。总览向P02展开已有占位，向四方向深读的职责互补，非两页总览。",
        "本次整包横审：已实际打开当前原图、390×520手机图与灰度图；未发现应重开本页完整审核的明确新内容关系、文字遮挡、手机关键内容不可读或系列归属阻断。",
        "完整等级来源沿用：[本地工作区]/outputs/EP59-三页设计重构-2026-10-06/P01/full-C-v1/review-workspace/04-rendered/independent_visual_review.json；原报告文件SHA-256=917deae0d64e9e3d4f0b0abb95f1e48d03ea6cef69bba08fba8bb94c6d7f2a55；原审核上下文=/root/p01_current_clean_reader。原报告PNG、原manifest canonical及当前scene/原图/390px/灰度四哈希一致，沿用原完整TARGET。本次横审不冒充新的单页完整审核。",
        "review_packet_sha256沿用原单页实际报告值cbf9f85eb4e519c143de6b22b638c53508805dc7eb1ed109d4e35c83eac2f424，该字段指向原单页包，不虚构本次新输入包。",
        "机械辅助：当前原生scene image=0/files=0；有效文字的typography_role与字号匹配共享当前tokens。参数与哈希核对不替代实图观察。"
      ]
    },
    {
      "page_id": "P02",
      "png_sha256": "11356fa9d1c312918ea8c460d34b124258331af0fadb114a96a26e72b8f62d76",
      "review_packet_sha256": "e62f8de7f1d3637f134e50d07caa764c236df6fc28312a5ce75e9fdd6080fc59",
      "verdict": "TARGET",
      "findings": [
        "阅读：标题→已有占位与降低门槛总判断→默认占位/主动安排对照→四交通方式代价→个人打车取舍→套餐/饮品类比与限定。上部关系最强；下部类比说明最密但390px保留非投资建议、非通用排名和时长比例不编码。导航同系列；灰度不依赖颜色辨状态。",
        "本次整包横审：已实际打开当前原图、390×520手机图与灰度图；未发现应重开本页完整审核的明确新内容关系、文字遮挡、手机关键内容不可读或系列归属阻断。",
        "完整等级来源沿用：[本地工作区]/outputs/EP59-交付待办逐项确认-2026-10-06/正式缺口修复-2026-10-06/current-review-inputs/P02/closeout-workspace/04-rendered/independent_visual_review.json；原报告文件SHA-256=f73a67519e5a7f566543399e8fda432031a20a07e5cb31c64b5a81847e1d35fc；原审核上下文=/root/frozen_p02_p03_review。原报告PNG、原manifest canonical及当前scene/原图/390px/灰度四哈希一致，沿用原完整TARGET。本次横审不冒充新的单页完整审核。",
        "review_packet_sha256沿用原单页实际报告值e62f8de7f1d3637f134e50d07caa764c236df6fc28312a5ce75e9fdd6080fc59，该字段指向原单页包，不虚构本次新输入包。",
        "机械辅助：当前原生scene image=0/files=0；有效文字的typography_role与字号匹配共享当前tokens。参数与哈希核对不替代实图观察。"
      ]
    },
    {
      "page_id": "P03",
      "png_sha256": "906a816a2d931fba5271daca2d2107fe960c949eef18e29077f9acdafff335cc",
      "review_packet_sha256": "86983c0b9322f2948f1fd1c770c5b01803cd020f147201718fd92b6f34410621",
      "verdict": "TARGET",
      "findings": [
        "阅读：标题→资讯组合结论→完整阅读/Catch-22回路→刷5小时追问→行业/宠物主题对照→分类及ETF边界。最强是小说回路与跨行业括号，两个模块在同页承担阅读背景和拓宽主题的互补职责；FOMO与小时追问较密但390px可辨。灰度仍可区分行业单组与跨行业主题。",
        "本次整包横审：已实际打开当前原图、390×520手机图与灰度图；未发现应重开本页完整审核的明确新内容关系、文字遮挡、手机关键内容不可读或系列归属阻断。",
        "完整等级来源沿用：[本地工作区]/outputs/EP59-交付待办逐项确认-2026-10-06/正式缺口修复-2026-10-06/P03-scoped-repair-v1/review-workspace/04-rendered/independent_visual_review.json；原报告文件SHA-256=3bb8ff7aa715e35187c43e41ae3f4bbd608431692e36929a8b4b1887b631e4c3；原审核上下文=/root/frozen_p02_p03_review。原报告PNG、原manifest canonical及当前scene/原图/390px/灰度四哈希一致，沿用原完整TARGET。本次横审不冒充新的单页完整审核。",
        "review_packet_sha256沿用原单页实际报告值86983c0b9322f2948f1fd1c770c5b01803cd020f147201718fd92b6f34410621，该字段指向原单页包，不虚构本次新输入包。",
        "机械辅助：当前原生scene image=0/files=0；有效文字的typography_role与字号匹配共享当前tokens。参数与哈希核对不替代实图观察。"
      ]
    },
    {
      "page_id": "P04",
      "png_sha256": "74c9c697a02b9b3ffb824d8c19faefc7567bd30d52c7e91ab12776357dda207c",
      "review_packet_sha256": "3a8f3a31ea31a2cca97c32d67d2162afc4736871883075d00afcff7ee939d231",
      "verdict": "TARGET",
      "findings": [
        "阅读：标题与节目非处方结论→顶部地图提纲→次数/重量/增肌目的三组→个人血糖仪观察→食品与医学边界。次数片段和重量未知的≠表达最强；下部医学未核查说明最密但390px可读，没有图形把次数、重量或水果反应外推为普遍疗效。地图移动到顶部但职责仍独立，提纲序号和正文对应。",
        "本次整包横审：已实际打开当前原图、390×520手机图与灰度图；未发现应重开本页完整审核的明确新内容关系、文字遮挡、手机关键内容不可读或系列归属阻断。",
        "完整等级来源沿用：[本地工作区]/outputs/EP59-交付待办逐项确认-2026-10-06/P04/scoped-repair-2026-10-06/full-A-v2/coordinator-review-current/scoped-submit/04-rendered/independent_visual_review.json；原报告文件SHA-256=b16a5cd7af3ecbf929bcea2ed028110cf5053161c38905e4db4deb4626804e61；原审核上下文=/root/p04_repaired_full_reviewer。原报告PNG、原manifest canonical及当前scene/原图/390px/灰度四哈希一致，沿用原完整TARGET。本次横审不冒充新的单页完整审核。",
        "review_packet_sha256沿用原单页实际报告值3a8f3a31ea31a2cca97c32d67d2162afc4736871883075d00afcff7ee939d231，该字段指向原单页包，不虚构本次新输入包。",
        "机械辅助：当前原生scene image=0/files=0；有效文字的typography_role与字号匹配共享当前tokens。参数与哈希核对不替代实图观察。"
      ]
    },
    {
      "page_id": "P05",
      "png_sha256": "76fc3538348a0f39a32eb0df5ef093653bf2fb701e95f1d34a4fd06387b82864",
      "review_packet_sha256": "dc1210915032ee760932e711054e917c2887bf4c5813d5811ceb275ae15efd7d",
      "verdict": "TARGET",
      "findings": [
        "阅读：标题→当下妨碍判断→无干扰/明显妨碍分叉→关系与工作例子→主讲人的发展任务解释→理论/诊断边界。最强是是否妨碍当下的分叉；末端理论限定细读负担最高但390px可辨。标题比邻页长且页眉下分隔局部笔触较重，未见字线冲突，正文并列解释对象保持同级；灰度分叉仍成立。",
        "本次整包横审：已实际打开当前原图、390×520手机图与灰度图；未发现应重开本页完整审核的明确新内容关系、文字遮挡、手机关键内容不可读或系列归属阻断。",
        "完整等级来源沿用：[本地工作区]/outputs/EP59-交付待办逐项确认-2026-10-06/正式缺口修复-2026-10-06/P05-scoped-repair-v1/review-workspace/04-rendered/independent_visual_review.json；原报告文件SHA-256=b87301e9993dd4e6361061e0e233269be73e4a0dca034d4f872b306b007dc692；原审核上下文=/root/frozen_p05_p06_review。原报告PNG、原manifest canonical及当前scene/原图/390px/灰度四哈希一致，沿用原完整TARGET。本次横审不冒充新的单页完整审核。",
        "review_packet_sha256沿用原单页实际报告值dc1210915032ee760932e711054e917c2887bf4c5813d5811ceb275ae15efd7d，该字段指向原单页包，不虚构本次新输入包。",
        "机械辅助：当前原生scene image=0/files=0；有效文字的typography_role与字号匹配共享当前tokens。参数与哈希核对不替代实图观察。"
      ]
    },
    {
      "page_id": "P06",
      "png_sha256": "f604db9fb0abfa918b5950e0e8b810c65c52d723f8c7d516c743f601f969ed5f",
      "review_packet_sha256": "061d6cf38a2b6cc877637beda6aff6e651c441c89b94a33a32a4690e995c638a",
      "verdict": "TARGET",
      "findings": [
        "阅读：标题→角色期待进入心理感受且个例非全体→左栏女性/男性两类观察→右栏职业个例→来源边界→提纲地图。外部期待至个人感受的水平关系最强，职业纸张分别归属资历/项目不混用；手机最弱是第三模块的群体推断边界，仍可辨读未独立验证和不可升格普遍事实。灰度保留左右分区与人物/纸张归属。",
        "本次整包横审：已实际打开当前原图、390×520手机图与灰度图；未发现应重开本页完整审核的明确新内容关系、文字遮挡、手机关键内容不可读或系列归属阻断。",
        "完整等级来源沿用：[本地工作区]/outputs/EP59-优化后单页重设计-2026-10-07/P06/case-B/full-v1/review-workspace/04-rendered/independent_visual_review.json；原报告文件SHA-256=c3127b423d75454ee9dd78dac25ba2e274e4cd4ac168ad13b8e354b37b6870cf；原审核上下文=/root/p06_optimized_reader。原报告PNG、原manifest canonical及当前scene/原图/390px/灰度四哈希一致，沿用原完整TARGET。本次横审不冒充新的单页完整审核。",
        "review_packet_sha256沿用原单页实际报告值061d6cf38a2b6cc877637beda6aff6e651c441c89b94a33a32a4690e995c638a，该字段指向原单页包，不虚构本次新输入包。",
        "机械辅助：当前原生scene image=0/files=0；有效文字的typography_role与字号匹配共享当前tokens。参数与哈希核对不替代实图观察。"
      ]
    },
    {
      "page_id": "P07",
      "png_sha256": "b6e91a52a01af797f19097e2271bb278684bf2fc8a6d8e06de145b0cd108ced6",
      "review_packet_sha256": "297281b27b3e45733f251599f944e83cfd72551648a6b0e29b39b13800cd6d69",
      "verdict": "TARGET",
      "findings": [
        "阅读：标题→不以消除为前提的主张→左事件/应对与保留痛苦→右正面变化压力→下方事件结束/反应继续→诊断边界。最强是同一痛苦仍在与两条不同结束线，未暗示痛苦减小。手机下右下断开关系的诊断文字需细读但可辨；分区和序号对应，灰度保持事件/应对差别。",
        "本次整包横审：已实际打开当前原图、390×520手机图与灰度图；未发现应重开本页完整审核的明确新内容关系、文字遮挡、手机关键内容不可读或系列归属阻断。",
        "完整等级来源沿用：[本地工作区]/outputs/github-release-slim-review-2026-10-01/e2e-6ab61d4b195d838e2ae9fc1e/02-visual-plan/deep-recreation-quality-restart-2026-10-04/P07/content-driven-macro-v6-2026-10-06/full-A-v1/coordinator-review-current/scoped-submit/04-rendered/independent_visual_review.json；原报告文件SHA-256=ef255513bf0b5c5dc9f0486ace6bb46fd5876615ece204af95f9a3ca44e6713a；原审核上下文=/root/p07_v6_reviewer。原报告PNG、原manifest canonical及当前scene/原图/390px/灰度四哈希一致，沿用原完整TARGET。本次横审不冒充新的单页完整审核。",
        "review_packet_sha256沿用原单页实际报告值297281b27b3e45733f251599f944e83cfd72551648a6b0e29b39b13800cd6d69，该字段指向原单页包，不虚构本次新输入包。",
        "机械辅助：当前原生scene image=0/files=0；有效文字的typography_role与字号匹配共享当前tokens。参数与哈希核对不替代实图观察。"
      ]
    },
    {
      "page_id": "P08",
      "png_sha256": "6bef58812cb4cdbb2508ca04cdb4bd48f32637a391bc3a32918391693a269217",
      "review_packet_sha256": "bdf10263f6c8380644d2ca39d5fbca9b893dd1b06a3d33fe791f31635bcfbc33",
      "verdict": "TARGET",
      "findings": [
        "阅读：标题→预测与当前全链条判断分开→同一五五股权例子的窄/宽观察范围→复杂性/非通用方案限定→过去结构变化与未来服务案例→预测边界。两个等分图形与50%一致，范围扩展最强；中段法律财税限定与营销链条文本最密但390px可辨。P07到P08切换健康/AI由地图明确，未假造因果；灰度范围括号仍清楚。",
        "本次整包横审：已实际打开当前原图、390×520手机图与灰度图；未发现应重开本页完整审核的明确新内容关系、文字遮挡、手机关键内容不可读或系列归属阻断。",